{
  "schema_version": "v1",
  "pack_id": "greet.wave",
  "version": "1.1.0",
  "format": 3,
  "notes": "arm_r_angle 로 손 흔들기 2회 펄스(0→20→0→20→0) + mouth_up=0.8 지속 미소. v1.0.0 의 body_angle_x placeholder 해소(session-04 D3).",
  "meta": {
    "duration_sec": 2.0,
    "fps": 30,
    "fade_in_sec": 0.3,
    "fade_out_sec": 0.3,
    "loop": false,
    "curve_count": 2,
    "total_segment_count": 5,
    "total_point_count": 7
  },
  "curves": [
    {
      "target": "parameter",
      "target_id": "arm_r_angle",
      "segments": [0, 0, 0, 0.5, 20, 0, 1.0, 0, 0, 1.5, 20, 0, 2.0, 0]
    },
    {
      "target": "parameter",
      "target_id": "mouth_up",
      "segments": [0, 0.8, 0, 2.0, 0.8]
    }
  ]
}
