{
  "schema_version": "v1",
  "pack_id": "idle.default",
  "version": "1.1.0",
  "format": 3,
  "notes": "4초 루프 — 호흡(2 cycle) + 미세 고개/상체 흔들림. v1.1.0: body_angle_y 추가(±1.5°, 2 cycle) → body_breath_phys(body_breath 100w + body_angle_y 20w) 2차 오프셋 유도. docs/03 §12.1 #3.",
  "meta": {
    "duration_sec": 4.0,
    "fps": 30,
    "fade_in_sec": 1.0,
    "fade_out_sec": 1.0,
    "loop": true,
    "curve_count": 4,
    "total_segment_count": 13,
    "total_point_count": 17
  },
  "curves": [
    {
      "target": "parameter",
      "target_id": "body_breath",
      "segments": [0, 0, 0, 1.0, 1, 0, 2.0, 0, 0, 3.0, 1, 0, 4.0, 0]
    },
    {
      "target": "parameter",
      "target_id": "body_angle_y",
      "segments": [0, 0, 0, 1.0, 1.5, 0, 2.0, 0, 0, 3.0, 1.5, 0, 4.0, 0]
    },
    {
      "target": "parameter",
      "target_id": "head_angle_x",
      "segments": [0, 0, 0, 2.0, 1, 0, 4.0, 0]
    },
    {
      "target": "parameter",
      "target_id": "head_angle_y",
      "segments": [0, 0, 0, 1.5, 0.5, 0, 3.0, -0.5, 0, 4.0, 0]
    }
  ]
}
