{
  "schema_version": "v1",
  "pack_id": "nod.yes",
  "version": "1.0.0",
  "format": 3,
  "notes": "1초, 2회 끄덕. head_angle_y 아래-위 2 cycle.",
  "meta": {
    "duration_sec": 1.0,
    "fps": 30,
    "fade_in_sec": 0.1,
    "fade_out_sec": 0.1,
    "loop": false,
    "curve_count": 1,
    "total_segment_count": 4,
    "total_point_count": 5
  },
  "curves": [
    {
      "target": "parameter",
      "target_id": "head_angle_y",
      "segments": [0, 0, 0, 0.25, -20, 0, 0.5, 0, 0, 0.75, -20, 0, 1.0, 0]
    }
  ]
}
