{
  "schema_version": "v1",
  "pack_id": "idle.sleepy",
  "version": "1.0.0",
  "format": 3,
  "notes": "6초 루프 — 느린 호흡 1 cycle + 눈 반쯤 감김 정적 유지.",
  "meta": {
    "duration_sec": 6.0,
    "fps": 30,
    "fade_in_sec": 1.5,
    "fade_out_sec": 1.5,
    "loop": true,
    "curve_count": 3,
    "total_segment_count": 4,
    "total_point_count": 7
  },
  "curves": [
    {
      "target": "parameter",
      "target_id": "body_breath",
      "segments": [0, 0, 0, 3.0, 1, 0, 6.0, 0]
    },
    {
      "target": "parameter",
      "target_id": "eye_open_l",
      "segments": [0, 0.5, 0, 6.0, 0.5]
    },
    {
      "target": "parameter",
      "target_id": "eye_open_r",
      "segments": [0, 0.5, 0, 6.0, 0.5]
    }
  ]
}
